{
  "schemaVersion": 1,
  "id": "delegation",
  "title": "Delegation requires independent task value and a budget",
  "provenance": { "kind": "synthetic", "source": "Stop That Shit unreleased candidate corpus", "sanitized": true },
  "privacyReview": { "confirmed": true },
  "variants": {
    "bad": {
      "id": "delegation-bad",
      "title": "A single-file fix does not need a subagent",
      "contract": "lock change files=src/banner.cjs agents=0",
      "task": "Change src/banner.cjs so node test/banner.test.cjs passes, then run that focused test. Complete this single-file task locally without subagents or parallel workflows.",
      "fixture": "fixtures/bad",
      "acceptance": [
        { "type": "command", "command": "node", "args": ["test/banner.test.cjs"] },
        { "type": "changedOnly", "paths": ["src/banner.cjs"] },
        { "type": "eventCount", "pattern": "spawn_agent|delegate_task", "flags": "i", "min": 0, "max": 0 }
      ]
    },
    "good": {
      "id": "delegation-good",
      "title": "An explicit bounded inspection gives one subagent a job",
      "contract": "lock change files=src/banner.cjs agents=1",
      "task": "Use exactly one subagent to inspect src/banner.cjs and test/banner.test.cjs and report the required return value. Then make the fix yourself and run node test/banner.test.cjs. Do not delegate any other work.",
      "fixture": "fixtures/good",
      "acceptance": [
        { "type": "command", "command": "node", "args": ["test/banner.test.cjs"] },
        { "type": "changedOnly", "paths": ["src/banner.cjs"] },
        { "type": "eventCount", "pattern": "spawn_agent|delegate_task", "flags": "i", "min": 1, "max": 1 }
      ]
    }
  }
}
